{
  "id_evento": "8f3c2a1e-5b7d-4c9a-9e21-3f6a0b7c1d42",
  "tipo_evento": "intento_pago",
  "version_esquema": "1.0",
  "equipo": "equipo9-v4",
  "fecha_evento": "2026-10-22T19:42:15.318Z",
  "id_pedido": "PED-20261022-004817",
  "id_cliente": "CLI-001523",
  "valor": 87500.0,
  "moneda": "COP",
  "medio_pago": "tarjeta_credito",
  "id_dispositivo": "DIS-7f21a9",
  "tipo_dispositivo": "android",
  "pais_ip": "CO",
  "ciudad": "Bogota",
  "latitud": 4.6533,
  "longitud": -74.0836,
  "numero_intento": 1,
  "estado": "aprobado",
  "motivo_rechazo": null
}
